{
  "schemaVersion": "platform.finance2/v1",
  "generatedAt": "2026-08-09T00:00:00Z",
  "environment": "dev",
  "cluster": {"contextRef":"fixture","namespace":"fixture-dev","version":null,"status":"DECLARED"},
  "capabilities": [],
  "inputs": [{"name":"runtimeSecrets","classification":"SECRET_REFERENCE","value":null,"reference":"secret-manager/path","evidence":"fixture contract","requiredFor":["runtime"],"status":"DECLARED"}],
  "sources": [{"state":"DECLARED","sourceType":"test","sourceRef":"sanitized fixture","capturedAt":"2026-08-09T00:00:00Z"}]
}
